[
  {
    "doc_id": "ad65ca16d2752f93",
    "filename": "1-ceza-dairesi-e-2024-2954-k-2025-9052-t-16-12-2025-1.md",
    "court": "Yargıtay",
    "daire": "1. Ceza Dairesi",
    "law_branch": "ceza",
    "court_level": 3,
    "esas_no": "2024/2954",
    "karar_no": "2025/9052",
    "decision_date": "16.12.2025",
    "topic_keywords": [
      "da Görüntüle\n\n\n\n kasten öldürme",
      "adam öldürmeye teşebbüs"
    ],
    "excluded": false,
    "exclude_reason": ""
  },
  {
    "doc_id": "e28fde4144d01b09",
    "filename": "1-ceza-dairesi-e-2024-3889-k-2025-8921-t-11-12-2025-1.md",
    "court": "Yargıtay",
    "daire": "1. Ceza Dairesi",
    "law_branch": "ceza",
    "court_level": 3,
    "esas_no": "2024/3889",
    "karar_no": "2025/8921",
    "decision_date": "11.12.2025",
    "topic_keywords": [
      "da Görüntüle\n\n\n\n meşru savunma",
      "haksız tahrik"
    ],
    "excluded": false,
    "exclude_reason": ""
  },
  {
    "doc_id": "5e5794bf4347f26b",
    "filename": "1-ceza-dairesi-e-2024-5092-k-2025-8923-t-11-12-2025-1.md",
    "court": "Yargıtay",
    "daire": "1. Ceza Dairesi",
    "law_branch": "ceza",
    "court_level": 3,
    "esas_no": "2024/5092",
    "karar_no": "2025/8923",
    "decision_date": "11.12.2025",
    "topic_keywords": [
      "da Görüntüle\n\n\n\n adil yargılamayı etkileme",
      "bilinçli taksir"
    ],
    "excluded": false,
    "exclude_reason": ""
  },
  {
    "doc_id": "9c2676f045915976",
    "filename": "1-ceza-dairesi-e-2024-5472-k-2025-8926-t-11-12-2025-1.md",
    "court": "Yargıtay",
    "daire": "1. Ceza Dairesi",
    "law_branch": "ceza",
    "court_level": 3,
    "esas_no": "2024/5472",
    "karar_no": "2025/8926",
    "decision_date": "11.12.2025",
    "topic_keywords": [
      "da Görüntüle\n\n\n\n kasten öldürme",
      "adam öldürmeye teşebbüs"
    ],
    "excluded": false,
    "exclude_reason": ""
  },
  {
    "doc_id": "f4c810679797eb44",
    "filename": "1-ceza-dairesi-e-2024-6671-k-2025-8927-t-11-12-2025-1.md",
    "court": "Yargıtay",
    "daire": "1. Ceza Dairesi",
    "law_branch": "ceza",
    "court_level": 3,
    "esas_no": "2024/6671",
    "karar_no": "2025/8927",
    "decision_date": "11.12.2025",
    "topic_keywords": [
      "da Görüntüle\n\n\n\n kasten öldürme",
      "iştirak\n\n\n    MAHKEMESİ"
    ],
    "excluded": false,
    "exclude_reason": ""
  },
  {
    "doc_id": "380172d61ae2c2df",
    "filename": "1-ceza-dairesi-e-2024-6850-k-2025-9015-t-15-12-2025-1.md",
    "court": "Yargıtay",
    "daire": "1. Ceza Dairesi",
    "law_branch": "ceza",
    "court_level": 3,
    "esas_no": "2024/6850",
    "karar_no": "2025/9015",
    "decision_date": "15.12.2025",
    "topic_keywords": [
      "da Görüntüle\n\n\n\n kasten yaralama",
      "asli fail"
    ],
    "excluded": false,
    "exclude_reason": ""
  },
  {
    "doc_id": "19a5f410315969bb",
    "filename": "1-ceza-dairesi-e-2025-1261-k-2025-8928-t-11-12-2025-1.md",
    "court": "Yargıtay",
    "daire": "1. Ceza Dairesi",
    "law_branch": "ceza",
    "court_level": 3,
    "esas_no": "2025/1261",
    "karar_no": "2025/8928",
    "decision_date": "11.12.2025",
    "topic_keywords": [
      "da Görüntüle\n\n\n\n kasten öldürme",
      "adam öldürmeye teşebbüs"
    ],
    "excluded": false,
    "exclude_reason": ""
  },
  {
    "doc_id": "5b0b84d272585ff6",
    "filename": "1-ceza-dairesi-e-2025-6240-k-2025-8940-t-11-12-2025-1.md",
    "court": "Yargıtay",
    "daire": "1. Ceza Dairesi",
    "law_branch": "ceza",
    "court_level": 3,
    "esas_no": "2025/6240",
    "karar_no": "2025/8940",
    "decision_date": "11.12.2025",
    "topic_keywords": [
      "da Görüntüle\n\n\n\n kasten öldürme",
      "adam öldürmeye teşebbüs"
    ],
    "excluded": false,
    "exclude_reason": ""
  },
  {
    "doc_id": "2395fbcda2f4b438",
    "filename": "1-ceza-dairesi-e-2025-6707-k-2025-9605-t-26-12-2025-1.md",
    "court": "Yargıtay",
    "daire": "1. Ceza Dairesi",
    "law_branch": "ceza",
    "court_level": 3,
    "esas_no": "2025/6707",
    "karar_no": "2025/9605",
    "decision_date": "26.12.2025",
    "topic_keywords": [
      "da Görüntüle\n\n\n\n kasten öldürme",
      "kasten yaralama"
    ],
    "excluded": false,
    "exclude_reason": ""
  },
  {
    "doc_id": "6950a3c6e88a878e",
    "filename": "1-ceza-dairesi-e-2025-7350-k-2025-8929-t-11-12-2025-1.md",
    "court": "Yargıtay",
    "daire": "1. Ceza Dairesi",
    "law_branch": "ceza",
    "court_level": 3,
    "esas_no": "2025/7350",
    "karar_no": "2025/8929",
    "decision_date": "11.12.2025",
    "topic_keywords": [
      "da Görüntüle\n\n\n\n kanun yararına bozma",
      "ek savunma hakkı"
    ],
    "excluded": false,
    "exclude_reason": ""
  },
  {
    "doc_id": "21798831a2666236",
    "filename": "1-hukuk-dairesi-e-2007-9815-k-2007-11607-1.md",
    "court": "Yargıtay",
    "daire": "1. Hukuk Dairesi",
    "law_branch": "hukuk",
    "court_level": 3,
    "esas_no": "2007/9815",
    "karar_no": "2007/11607",
    "decision_date": "14.06.2007",
    "topic_keywords": [],
    "excluded": false,
    "exclude_reason": ""
  },
  {
    "doc_id": "aa187046abb703e9",
    "filename": "1-hukuk-dairesi-e-2014-22602-k-2017-953-1.md",
    "court": "Yargıtay",
    "daire": "1. Hukuk Dairesi",
    "law_branch": "hukuk",
    "court_level": 3,
    "esas_no": "2014/22602",
    "karar_no": "2017/953",
    "decision_date": "",
    "topic_keywords": [],
    "excluded": false,
    "exclude_reason": ""
  },
  {
    "doc_id": "68732b39281b9d1a",
    "filename": "1-hukuk-dairesi-e-2024-1977-k-2025-5810-t-9-12-2025-1.md",
    "court": "Yargıtay",
    "daire": "1. Hukuk Dairesi",
    "law_branch": "hukuk",
    "court_level": 3,
    "esas_no": "2024/1977",
    "karar_no": "2025/5810",
    "decision_date": "09.12.2025",
    "topic_keywords": [
      "da Görüntüle\n\n\n\n muris muvazaası",
      "tapu iptali"
    ],
    "excluded": false,
    "exclude_reason": ""
  },
  {
    "doc_id": "fe4d6395ceb0a6d8",
    "filename": "1-hukuk-dairesi-e-2024-256-k-2025-5811-t-9-12-2025-1.md",
    "court": "Yargıtay",
    "daire": "1. Hukuk Dairesi",
    "law_branch": "hukuk",
    "court_level": 3,
    "esas_no": "2024/256",
    "karar_no": "2025/5811",
    "decision_date": "09.12.2025",
    "topic_keywords": [
      "da Görüntüle\n\n\n\n ehliyetsizlik",
      "eksik inceleme"
    ],
    "excluded": false,
    "exclude_reason": ""
  },
  {
    "doc_id": "eca96b13d5626342",
    "filename": "1-hukuk-dairesi-e-2024-5797-k-2025-5772-t-8-12-2025-1.md",
    "court": "Yargıtay",
    "daire": "1. Hukuk Dairesi",
    "law_branch": "hukuk",
    "court_level": 3,
    "esas_no": "2024/5797",
    "karar_no": "2025/5772",
    "decision_date": "08.12.2025",
    "topic_keywords": [
      "da Görüntüle\n\n\n\n yazılı delil başlangıcı",
      "alıcının temerrüdü"
    ],
    "excluded": false,
    "exclude_reason": ""
  },
  {
    "doc_id": "8e484aacfba6dabc",
    "filename": "1-hukuk-dairesi-e-2025-5420-k-2025-5720-t-4-12-2025-1.md",
    "court": "Yargıtay",
    "daire": "1. Hukuk Dairesi",
    "law_branch": "hukuk",
    "court_level": 3,
    "esas_no": "2025/5420",
    "karar_no": "2025/5720",
    "decision_date": "04.12.2025",
    "topic_keywords": [
      "da Görüntüle\n\n\n\n resmi şekil",
      "ehliyetsizlik"
    ],
    "excluded": false,
    "exclude_reason": ""
  },
  {
    "doc_id": "5d2053619e32a5d2",
    "filename": "10-ceza-dairesi-e-2024-6367-k-2026-362-t-15-1-2026-1.md",
    "court": "Yargıtay",
    "daire": "10. Ceza Dairesi",
    "law_branch": "ceza",
    "court_level": 3,
    "esas_no": "2024/6367",
    "karar_no": "2026/362",
    "decision_date": "15.01.2026",
    "topic_keywords": [
      "da Görüntüle\n\n\n\n etkin pişmanlık",
      "zincirleme suç\n\n\n    TUTUKLU\n\n    MAHKEMESİ"
    ],
    "excluded": false,
    "exclude_reason": ""
  },
  {
    "doc_id": "5e3cdf774c6a6e35",
    "filename": "10-ceza-dairesi-e-2024-8203-k-2026-166-t-13-1-2026-1.md",
    "court": "Yargıtay",
    "daire": "10. Ceza Dairesi",
    "law_branch": "ceza",
    "court_level": 3,
    "esas_no": "2024/8203",
    "karar_no": "2026/166",
    "decision_date": "13.01.2026",
    "topic_keywords": [
      "da Görüntüle\n\n\n\n kanun yararına bozma",
      "denetimli serbestlik"
    ],
    "excluded": false,
    "exclude_reason": ""
  },
  {
    "doc_id": "d3c2cf1f070b4803",
    "filename": "10-ceza-dairesi-e-2024-8222-k-2026-158-t-13-1-2026-1.md",
    "court": "Yargıtay",
    "daire": "10. Ceza Dairesi",
    "law_branch": "ceza",
    "court_level": 3,
    "esas_no": "2024/8222",
    "karar_no": "2026/158",
    "decision_date": "13.01.2026",
    "topic_keywords": [
      "da Görüntüle\n\n\n\n kanun yararına bozma",
      "denetimli serbestlik"
    ],
    "excluded": false,
    "exclude_reason": ""
  },
  {
    "doc_id": "0ac622d224fb529a",
    "filename": "2-hukuk-dairesi-e-2011-21393-k-2012-17963-1.md",
    "court": "İlk Derece",
    "daire": "Denizli 2. Aile Mahkemesi",
    "law_branch": "hukuk",
    "court_level": 1,
    "esas_no": "2011/21393",
    "karar_no": "2012/17963",
    "decision_date": "16.09.2011",
    "topic_keywords": [],
    "excluded": false,
    "exclude_reason": ""
  },
  {
    "doc_id": "88145bb360d534ee",
    "filename": "2-hukuk-dairesi-e-2014-8960-k-2014-20128-1.md",
    "court": "İlk Derece",
    "daire": "Kocaeli 3. Aile Mahkemesi",
    "law_branch": "hukuk",
    "court_level": 1,
    "esas_no": "2014/8960",
    "karar_no": "2014/20128",
    "decision_date": "08.01.2014",
    "topic_keywords": [],
    "excluded": false,
    "exclude_reason": ""
  },
  {
    "doc_id": "7415bfb5868932f2",
    "filename": "2-hukuk-dairesi-e-2020-2401-k-2020-3512-1.md",
    "court": "Yargıtay",
    "daire": "2. Hukuk Dairesi",
    "law_branch": "hukuk",
    "court_level": 3,
    "esas_no": "2020/2401",
    "karar_no": "2020/3512",
    "decision_date": "",
    "topic_keywords": [],
    "excluded": false,
    "exclude_reason": ""
  },
  {
    "doc_id": "2151297528ed418e",